{
  "schemaVersion": 1,
  "adjudicationId": "ADJ-PREM-QNT-009-CD60CE7C-BC39-43F6-82A5-F44529F515D1",
  "lessonId": "PREM-QNT-009",
  "lessonVersion": "0.2.0",
  "candidateCommit": "ecef30b0584f5968b06bb7d5990fc379f2dbf77a",
  "finalCommit": "cf842b61f8ac8b30a34502fa516866e51933c7a4",
  "riskTier": "standard",
  "policyId": "standard-lesson-v3",
  "reviewIds": [
    "REV-PREM-QNT-009-7A824977-4D2D-4E2B-967B-A2EBFCF0811E",
    "REV-PREM-QNT-009-ACADEMIC-5DCF0A3A"
  ],
  "quorum": {
    "satisfied": true,
    "approvals": 1,
    "reviewInputs": 2,
    "changeRequests": 1,
    "roleCounts": {
      "academic": 1,
      "learningDesign": 1,
      "accessibilityRights": 0
    },
    "distinctPrincipals": 1,
    "distinctAgentRuns": 2,
    "distinctAgentModelFamilies": 2
  },
  "decision": "merge",
  "finalization": {
    "materialChanges": [
      "Reframed the joint-force scene as an explicitly fictional coordinate model that does not define a bone free body, contact plane, or compression/tension convention.",
      "Replaced the unsupported compression and shear labels with a signed axial projection and perpendicular component, stated their coordinate-only meaning, and made the perpendicular-vector calculation explicit.",
      "Defined newtons (N) at first use and strengthened the closing boundary to state that the exercise is not a biomechanical model or medical advice."
    ],
    "reviewDispositions": [
      {
        "reviewId": "REV-PREM-QNT-009-7A824977-4D2D-4E2B-967B-A2EBFCF0811E",
        "findingIndex": 0,
        "action": "no-change-required",
        "rationale": "The finding reports no glossary collision or terminology shift and requests no correction. The final pack retains the candidate's vector-term definitions unchanged; cross-lesson registry inspection was outside this finalizer's scope."
      },
      {
        "reviewId": "REV-PREM-QNT-009-7A824977-4D2D-4E2B-967B-A2EBFCF0811E",
        "findingIndex": 1,
        "action": "no-change-required",
        "rationale": "The misconception scene already contains prediction, tempting-model identification, counterexamples, failure explanation, repair, and a new recheck with feedback, so the favorable finding requires no edit."
      },
      {
        "reviewId": "REV-PREM-QNT-009-7A824977-4D2D-4E2B-967B-A2EBFCF0811E",
        "findingIndex": 2,
        "action": "no-change-required",
        "rationale": "No corrective change was requested. The final scene retains the relevant fictional joint-coordinate transfer context, correct vector arithmetic, dot-product alignment check, and projections; its compression/shear characterization was not retained because the academic finding identified missing mechanical assumptions."
      },
      {
        "reviewId": "REV-PREM-QNT-009-7A824977-4D2D-4E2B-967B-A2EBFCF0811E",
        "findingIndex": 3,
        "action": "incorporated",
        "rationale": "The revised opening now states that force is measured in newtons (N) before the first numerical use of the symbol."
      },
      {
        "reviewId": "REV-PREM-QNT-009-ACADEMIC-5DCF0A3A",
        "findingIndex": 0,
        "action": "incorporated",
        "rationale": "The final scene follows the reviewer's first remediation path: it explicitly defines a fictional coordinate model, removes compression and shear labels, reports only signed axial and perpendicular components, and states that no free body, contact plane, or mechanical sign convention is defined. The scene therefore remains no-material-claims and requires no biomechanics source."
      },
      {
        "reviewId": "REV-PREM-QNT-009-ACADEMIC-5DCF0A3A",
        "findingIndex": 1,
        "action": "no-change-required",
        "rationale": "The reviewer independently confirmed the transfer-assessment calculations, angle convention, quadrant, units, scalar projection, and triangle bound. No answer-key change is warranted."
      },
      {
        "reviewId": "REV-PREM-QNT-009-ACADEMIC-5DCF0A3A",
        "findingIndex": 2,
        "action": "no-change-required",
        "rationale": "The reviewer independently confirmed the worked example's components, normalization, reconstruction, dot product, included angle, scalar projection, quadrant handling, and zero-vector boundaries. No content change is warranted."
      }
    ],
    "accessibilityRightsAudit": {
      "satisfied": true,
      "evidenceChecked": [
        "Read the complete final pack in declared scene order and confirmed one level-one heading per scene, meaningful subordinate headings, linear prompt-to-feedback order, and prose recovery routes.",
        "Confirmed every essential vector relationship is available through words, signed tuples, and dollar-delimited TeX; no task depends on color, position, audio, animation, pointer input, dragging, hover, or timing.",
        "Confirmed practice explicitly supports print and screen-reader answer-before-feedback use, while the final check and assessment remain text-answerable without a visual or physical task.",
        "Scanned scene Markdown for raw HTML tags, HTML entities, unsafe TeX I/O or macro commands, JavaScript, and remote embeds; none were found.",
        "Recomputed the revised scene's force components, resultant, direction, dot product, axial projection, perpendicular component, and norm check and found the displayed rounded values consistent.",
        "Confirmed assessment acceptable responses are JSON strings, all pack JSON parses, references use allowed types and ISO date forms, and the lesson identity, version, draft status, and empty third-party-assets list remain unchanged.",
        "Inspected the single NIST reference's facts-only-original-expression use, rights evidence, licence summary, public terms route, dated checked-no-agent-restriction-found record, and non-human-only access status.",
        "Inspected ATTRIBUTION.md, the CC BY 4.0 lesson grant, author and reviewer provenance, the absence of copied expression, datasets, third-party assets, patient material, and personal data, and this adjudicator disclosure."
      ],
      "limitations": [
        "The audit was static: no live screen-reader, keyboard, touch, 200% zoom/reflow, browser-rendering, MathML, print, or planned non-web export test was run.",
        "NIST source support, current terms, and robots behavior were not rechecked externally; the audit relies on the pack's dated access record and the academic review's source inspection.",
        "At the operator's explicit scope boundary, site-hosted schemas and quorum files were not read, GitHub COMMENTED transports were not independently fetched, and npm validation was not run. Eligibility uses the supplied policy/schema constraints, the locally parsed review artifacts, and the operator-attested non-dismissed transports."
      ]
    }
  },
  "rationale": "The two advisory inputs target the same original candidate and lesson version, cover the required academic and learning-design roles, disclose distinct agent runs and model families across OpenAI and Google, declare no conflicts, and have one approve and one request-changes verdict. Their GitHub COMMENTED transports are treated as operator-attested non-dismissed inputs; agent provenance is disclosed rather than independently verified. Every indexed finding is disposed. The only major finding identified unsupported biomechanical interpretation in the original clinical wrap-up; the one-pass final revision removes those labels, makes the coordinate-only boundary explicit, defines the unit symbol, and preserves the verified vector mathematics. Scoped structural, arithmetic, accessibility, source-record, rights, privacy, security, attribution, and provenance checks found no remaining blocker. Subject to replacing the required commit/runtime placeholders and completing repository and pull-request checks, the evidence supports merge without another review cohort.",
  "dissent": [
    "The academic reviewer issued request-changes because the original candidate called axial and perpendicular projections compression and shear without a supporting mechanical model or source. That material dissent is preserved; the final revision resolves it by removing the mechanical labels and explicitly limiting the exercise to fictional coordinate components."
  ],
  "conditions": [
    "Before merge, the operator must commit the coherent final content revision, replace PENDING-FINAL-COMMIT with that exact 40-character SHA, and stamp the four RUNTIME-STAMPED adjudicator identity fields from the runtime banner.",
    "Before merge, the operator must run the repository-required validation and pull-request readiness/provenance checks that this scoped run was explicitly prohibited from running.",
    "The maintainer, not this finalizer, performs only the allowed post-finalization publication transition for lesson status, source confidence, and any retained claim review-status fields."
  ],
  "adjudicator": {
    "principalId": "github:VSBDev",
    "displayName": "VSBDev — accountable fresh finalizer and adjudicator",
    "agent": {
      "system": "OpenAI Codex",
      "provider": "OpenAI",
      "model": "gpt-5.6-sol",
      "version": "codex-cli 0.144.6",
      "runId": "codex-finalizer-PREM-QNT-009-CD60CE7C-BC39-43F6-82A5-F44529F515D1",
      "instructionsDigest": "sha256:a6112d82c8e5d9a394420d1a42740a9a32a6a2de6bec0d4d6612d6de81a3e69b"
    }
  },
  "adjudicatedAt": "2026-07-24T21:06:44Z"
}
