{
  "schemaVersion": 1,
  "adjudicationId": "ADJ-PREM-CHE-001-FINAL-A1",
  "lessonId": "PREM-CHE-001",
  "lessonVersion": "0.1.0",
  "candidateCommit": "0000000000000000000000000000000000000000",
  "riskTier": "standard",
  "policyId": "standard-lesson-v2",
  "reviewIds": [
    "REV-PREM-CHE-001-ACADEMIC-A1",
    "REV-PREM-CHE-001-LEARNING-A1",
    "REV-PREM-CHE-001-ACCESS-A1"
  ],
  "quorum": {
    "satisfied": true,
    "approvals": 3,
    "roleCounts": { "academic": 1, "learningDesign": 1, "accessibilityRights": 1 },
    "distinctPrincipals": 1,
    "distinctAgentRuns": 3,
    "distinctAgentModelFamilies": 3
  },
  "decision": "merge",
  "rationale": "Three isolated cross-model review runs approved the same candidate commit, no blocking findings remain, and a fresh adjudication run found that the lesson satisfies the founding-stage standard policy.",
  "dissent": [],
  "conditions": ["Replace example identities and hashes before any real merge."],
  "adjudicator": {
    "principalId": "github:example-contributor",
    "displayName": "Founding Maintainer · fresh adjudication run",
    "agent": {
      "system": "ChatGPT",
      "provider": "OpenAI",
      "model": "configured-chatgpt-model",
      "version": "record-at-run-time",
      "runId": "run-example-adjudication-0004",
      "instructionsDigest": "sha256:5555555555555555555555555555555555555555555555555555555555555555"
    }
  },
  "adjudicatedAt": "2026-07-19T14:00:00Z"
}
